{
  "$schema": "../../../../../../fogpack.schema.v1.json",
  "version": "1.0.0",
  "name": "Miami Vibes",
  "identifier": "seface:miami_vibes",
  "description": "",
  "authors": ["Seface Studios"],

  "config": {
    "sky": {
      "color": "#FE7678"
    },

    "fog": {
      "color": "#FE608E"
    }
  }
}