{
  "$schema": "https://www.sefacestudios.net/fogpack.schema.v1.json",
  "version": "1.0.0",
  "name": "Swamp Lands",
  "identifier": "seface:swamp_lands",
  "description": "What are you doing in my swamp?!",
  "authors": ["Seface Studios"],

  "config": {
    "sky": {
      "color": "#ABD2C8"
    },

    "fog": {
      "color": "#67917A"
    }
  }
}
