{
  "$schema": "https://www.sefacestudios.net/fogpack.schema.v1.json",
  "version": "1.0.0",
  "name": "Miami Vibes",
  "identifier": "seface:miami_vibes",
  "description": "Lucia... Do you know why you're here? - Bad luck, I guess.",
  "authors": ["Seface Studios"],

  "config": {
    "sky": {
      "color": "#FE7678"
    },

    "fog": {
      "color": "#FE608E"
    }
  }
}
